{
  "slug": "kine-ejemplo",
  "template": "clinic",
  "name": "Kine Ejemplo",
  "tagline": "Kinesiología y rehabilitación en Coquimbo. Agenda tu evaluación por WhatsApp.",
  "phone_wa": "56912345678",
  "city": "Coquimbo",
  "address": "Av. del Mar 890, oficina 3, Coquimbo",
  "maps_url": "https://www.google.com/maps/search/?api=1&query=Avenida+del+Mar+Coquimbo",
  "hours": [
    { "days": "Lun–Vie", "time": "09:00–18:00" },
    { "days": "Sáb", "time": "09:00–13:00" },
    { "days": "Dom", "time": "Cerrado" }
  ],
  "menu": [
    { "category": "Evaluación", "name": "Primera consulta", "desc": "Evaluación funcional y plan de tratamiento", "price": "$25.000" },
    { "category": "Sesión", "name": "Sesión de kinesiología", "desc": "Tratamiento según plan acordado", "price": "$20.000" },
    { "category": "Deporte", "name": "Readaptación deportiva", "desc": "Vuelta al deporte post-lesión", "price": "$22.000" },
    { "category": "Hogar", "name": "Visita a domicilio", "desc": "Según sector y disponibilidad", "price": "Consultar" }
  ],
  "stats": [
    { "value": "45", "label": "Min. sesión" },
    { "value": "Agenda", "label": "Por WhatsApp" },
    { "value": "Fonasa", "label": "Consultar" }
  ],
  "marquee": ["Rehabilitación", "Deporte", "Dolor lumbar", "Agenda por WhatsApp"],
  "about": "Atención personalizada en Coquimbo. Esta demo muestra horarios, prestaciones y contacto directo.",
  "hero_title": "Muévete mejor",
  "seo_title": "Kine Ejemplo · Kinesiología en Coquimbo",
  "seo_description": "Kinesiología y rehabilitación en Coquimbo. Agenda por WhatsApp. Demo de sitio web para clínicas locales.",
  "wa_message": "Hola Kine Ejemplo, quiero agendar una evaluación",
  "colors": { "primary": "#0d9488" },
  "show_demo_badge": true
}
